{
 "$schema": "http://json-schema.org/draft-07/schema#",
 "title": "Sycamore Event",
 "type": "object",
 "required": [
  "id",
  "t",
  "sev",
  "title",
  "src",
  "loc",
  "lat",
  "lon",
  "ts",
  "sources",
  "score"
 ],
 "properties": {
  "id": {
   "type": "integer",
   "minimum": 1,
   "description": "Stable, monotonically increasing. Generated by ingest; never reused.",
   "maximum": 9007199254740991
  },
  "t": {
   "type": "string",
   "enum": [
    "cyber",
    "geopolitical",
    "maritime",
    "military"
   ],
   "description": "Topic bucket."
  },
  "sev": {
   "type": "string",
   "enum": [
    "critical",
    "escalating",
    "watching",
    "deesc"
   ],
   "description": "Severity tier assigned by ingest; see D-003 for thresholds."
  },
  "title": {
   "type": "string",
   "minLength": 10,
   "maxLength": 200,
   "description": "Headline. Plain language, no clickbait."
  },
  "summary": {
   "type": "string",
   "maxLength": 1000,
   "description": "Optional 1-3 sentence context. Sourced language, not LLM-written."
  },
  "src": {
   "type": "string",
   "description": "Short human-readable source label (e.g. 'GDELT \u2014 Reuters')."
  },
  "loc": {
   "type": "string",
   "description": "Human-readable location, 'City, CC' or 'Sea, INT'."
  },
  "lat": {
   "type": "number",
   "minimum": -90,
   "maximum": 90
  },
  "lon": {
   "type": "number",
   "minimum": -180,
   "maximum": 180
  },
  "ts": {
   "type": "integer",
   "description": "Original event timestamp from source, ms since epoch UTC.",
   "minimum": 0,
   "maximum": 8640000000000000
  },
  "ingestedAt": {
   "type": "integer",
   "description": "When our ingest saw it, ms since epoch UTC.",
   "minimum": 0,
   "maximum": 8640000000000000
  },
  "sources": {
   "type": "array",
   "minItems": 1,
   "items": {
    "type": "string",
    "format": "uri",
    "description": "Original article URL(s).",
    "pattern": "^https?://"
   }
  },
  "score": {
   "type": "object",
   "required": [
    "articles",
    "tone"
   ],
   "properties": {
    "articles": {
     "type": "integer",
     "minimum": 1,
     "description": "Distinct source articles."
    },
    "tone": {
     "type": "number",
     "minimum": -100,
     "maximum": 100,
     "description": "GDELT tone average (-100 hostile, +100 hopeful)."
    },
    "quality": {
     "type": "number",
     "minimum": 0,
     "maximum": 100,
     "description": "Our internal quality score (0=garbage, 100=citable)."
    },
    "confidence": {
     "type": "integer",
     "minimum": 1,
     "maximum": 97,
     "description": "D-012: our local estimate of corroboration strength \u2014 source quality + distinct reporting outlets + recency. An ESTIMATE about sourcing, never a claim the incident is true."
    },
    "corroboration": {
     "type": "object",
     "required": [
      "sources"
     ],
     "properties": {
      "sources": {
       "type": "array",
       "items": {
        "type": "string",
        "format": "uri",
        "pattern": "^https?://"
       },
       "description": "All corroborating article URLs (mirrors top-level sources[])."
      },
      "outlets": {
       "type": "array",
       "items": {
        "type": "string"
       },
       "description": "Distinct reporting hostnames, in first-seen order."
      }
     }
    }
   }
  },
  "media": {
   "type": "object",
   "description": "D-020 event imagery, populated at ingest time only when the source feed ships an explicit image reference (Media RSS / enclosure) or a resolvable og:image on the article page. image is a same-origin path under public/data/media/ downloaded and size-capped by the ingest service; video_url is an external watch link from yt:videoId, never embedded.",
   "properties": {
    "image": {
     "type": "string",
     "pattern": "^data/media/[a-f0-9]{16}\\.jpe?g$",
     "description": "Same-origin path, relative to the site root. Absent = no verified image; UI must not fabricate one."
    },
    "video_url": {
     "type": "string",
     "format": "uri",
     "pattern": "^https://www\\.youtube\\.com/watch\\?v=[A-Za-z0-9_-]{6,25}$",
     "description": "External watch link only (yt:videoId from the feed). Never embedded; user leaves the site on click."
    }
   }
  },
  "geo": {
   "type": "object",
   "description": "D-014/D-020: provenance of the event's lat/lon. tier=precise means a real place was resolved; tier=approximate means a representative point is shown (geo.scope says whether country, city or region) and the marker is intentionally approximate, not incident-site accurate. Legacy rows pre-D-014 may lack this object; the client treats absence as approximate.",
   "required": [
    "tier",
    "source"
   ],
   "properties": {
    "tier": {
     "type": "string",
     "enum": [
      "precise",
      "approximate"
     ]
    },
    "source": {
     "type": "string",
     "enum": [
      "source",
      "nominatim",
      "title",
      "summary"
     ],
     "description": "Which code path produced the coordinates: source = article-supplied (GDELT), nominatim = online geocoder, title = local city/country lookup."
    }
   }
  }
 },
 "additionalProperties": false
}
